قطر مرادف الارهاب ,hate
طز فيك و باللقاء تبعكن لقاء الأوباش و قطاع الطرق إن دعوت شيخ عقل الإقطاع الارسلاني هو تدخل بشؤون طائفة الم… ,abusive
ولاك انت مسيحي شو لويش حاشر منخارك بين المسلمين,hate
دمدوم كم مرة صرت مفهمك معاش تستحمري صايرة متل شحاطة الاصبع ما بينضهر فيكي,abusive
جنسهم جبران باسيل وقبص اللي فيه النصيب لك يلعن هيك سياسيين واطيين,hate
شاوري معلمك طنبر الجاهلية بالأول قبل ما تغيرييها بلكي ألو رأي تاني أو مثل عادته بيستعين بصديق حبيت ,abusive
ههههههه على فكرة بس اقرأي رد وليد بيك منيح حاجة تتحمرني,abusive
هاي يا غلن؟إي إنت أول شي ضحكة بقرة معلوفة بمعمل مرتدلة تاني شي يا شريف مكة إنت مع إنو مكة أشرف منك جماعتك شو قدموا ,abusive
